repo,url,stars,year,has_package_swift,description,language,topics,archived,open_issues,iOS,macOS,watchOS,tvOS,visionOS,platform_count
google/GoogleSignIn-iOS,https://github.com/google/GoogleSignIn-iOS.git,628.0,2025.0,True,Enables iOS and macOS apps to sign in with Google.,Objective-C,"ios-sdk, authentication, oauth2, openid-connect",False,87.0,12.0,,,,,1
GottaGetSwifty/CodableWrappers,https://github.com/GottaGetSwifty/CodableWrappers.git,698.0,2025.0,True,Make Custom Serialization of Swift Codable Types easy with Annotations,Swift,"swift, ios, property-wrappers, codable, swift-library, swift-package, swift6, swiftmacro, swiftmacros",False,2.0,14.0,11.0,7.0,14.0,1.0,6
GraphQLSwift/Graphiti,https://github.com/GraphQLSwift/Graphiti.git,546.0,2025.0,True,The Swift GraphQL Schema framework for macOS and Linux,Swift,"graphql, swift, vapor, swiftpm, swift-nio, graphiti",False,20.0,,,,,,0
GraphQLSwift/GraphQL,https://github.com/GraphQLSwift/GraphQL.git,953.0,2025.0,True,The Swift GraphQL implementation for macOS and Linux,Swift,"graphql, swift, vapor, swiftpm, swift-nio, graphiti",False,7.0,,,,,,0
groue/GRDB.swift,https://github.com/groue/GRDB.swift.git,7665.0,2025.0,True,"A toolkit for SQLite databases, with a focus on application development",Swift,"sqlite, database, sql, sql-builder, grdb, spm, sqlite-databases, database-observation",False,5.0,13.0,,7.0,13.0,,3
groue/GRMustache.swift,https://github.com/groue/GRMustache.swift.git,624.0,2025.0,True,Flexible Mustache templates for Swift,Swift,"template-engine, mustache",False,14.0,11.0,,,9.0,,2
grpc/grpc-swift,https://github.com/grpc/grpc-swift.git,2172.0,2025.0,True,The Swift language implementation of gRPC.,Swift,"grpc, swift-grpc, protocol-buffers, swift",False,97.0,,,,,,0
hackiftekhar/IQKeyboardManager,https://github.com/hackiftekhar/IQKeyboardManager.git,16585.0,2025.0,True,Codeless drop-in universal library allows to prevent issues of keyboard sliding up and cover UITextField/UITextView. Neither need to write any code nor any setup required and much more.,Swift,"objective-c, keyboard, swift, iqkeyboardmanager, xcode",False,14.0,13.0,,,,,1
HaishinKit/HaishinKit.swift,https://github.com/HaishinKit/HaishinKit.swift.git,2917.0,2025.0,True,"Camera and Microphone streaming library via RTMP and SRT for iOS, macOS, tvOS and visionOS.",Swift,"rtmp, streaming, camera, replaykit, srt, ios, macos, tvos, visionos",False,5.0,13.0,,,13.0,1.0,4
hamcrest/OCHamcrest,https://github.com/hamcrest/OCHamcrest.git,717.0,2025.0,True,"Hamcrest for Objective-C: Powerful, combinable, extensible matchers for verification",Objective-C,"hamcrest, objective-c, xctest, testing",False,0.0,9.0,,2.0,9.0,,3
HeroTransitions/Hero,https://github.com/HeroTransitions/Hero.git,22349.0,2025.0,True,Elegant transition library for iOS & tvOS,Swift,"animation, custom-transitions, swift, ios, ios-animation, ios-transition, material-design, transition-animation, animations, ios-swift, ios-lib, hero, xcode, ios-framework, carthage, swiftpm, layout",False,40.0,10.0,,,10.0,,2
Hi-Rez/Satin,https://github.com/Hi-Rez/Satin.git,819.0,2025.0,True,A 3D Graphics Framework built on Apple's Metal,Swift,"swift, 3d, graphics, metal, metalkit, augmented-reality, shaders, metalapi, gfx, satin, xcode, 3d-graphics-framework, apple-metal",True,0.0,17.0,14.0,,,2.0,3
hmlongco/Factory,https://github.com/hmlongco/Factory.git,2480.0,2025.0,True,A modern approach to Container-Based Dependency Injection for Swift and SwiftUI.,Swift,"container, dependency-injection, ios, swift, swiftui, xcode",False,4.0,13.0,,8.0,13.0,1.0,4
huggingface/swift-transformers,https://github.com/huggingface/swift-transformers.git,1031.0,2025.0,True,Swift Package to implement a transformers-like API in Swift,Swift,,False,32.0,16.0,13.0,,,,2
hummingbird-project/hummingbird,https://github.com/hummingbird-project/hummingbird.git,1494.0,2025.0,True,"Lightweight, flexible HTTP server framework written in Swift",Swift,"server-side-swift, http-server, server, web-server, swift-nio, swift, http, web",False,24.0,17.0,14.0,,17.0,1.0,5
hylo-lang/hylo,https://github.com/hylo-lang/hylo.git,1380.0,2025.0,True,The Hylo programming language,Swift,programming-language,False,209.0,,13.0,,,,1
hyperoslo/Cache,https://github.com/hyperoslo/Cache.git,3098.0,2025.0,True,:package: Nothing but Cache.,Swift,"cache, cache-storage, disk-cache, memory-cache, swift, ios",False,13.0,,,,,,0
iAmMccc/SmartCodable,https://github.com/iAmMccc/SmartCodable.git,634.0,2025.0,True,"SmartCodable is a data parsing library based on Codable. It is simple to use, with robust compatibility being one of its main features. SmartCodable 是基于Codable实现的数据解析库。简单易用，强悍的兼容性是SmartCodable的主要特点。  表层API和功能几乎和HandyJSON一致，支持快速的迁移。",Swift,"codable, handyjson, json, mapping, serialization, swift, swift-codable, metacodable, swift-syntax-builder",False,1.0,13.0,,6.0,13.0,1.0,5
ifitdoesntwork/DAExpandAnimation,https://github.com/ifitdoesntwork/DAExpandAnimation.git,581.0,2025.0,True,A custom modal transition that presents a controller with an expanding effect while sliding out the presenter remnants.,Swift,"animation, ios, transition, uikit, swift6",False,3.0,8.0,,,,,1
Instagram/IGListKit,https://github.com/Instagram/IGListKit.git,13015.0,2025.0,True,A data-driven UICollectionView framework for building fast and flexible lists.,Objective-C,"uicollectionview, ios, objective-c, diffing, instagram",False,163.0,11.0,,,11.0,,2
isaced/ISEmojiView,https://github.com/isaced/ISEmojiView.git,540.0,2025.0,True,Emoji Keyboard for iOS,Swift,"emoji, emoji-keyboard, swift",False,15.0,12.0,,,,,1
JanGorman/Agrume,https://github.com/JanGorman/Agrume.git,857.0,2025.0,True,🍋 A lemony fresh iOS image viewer written in Swift.,Swift,"swift, image, image-viewer, ios, cocoapods, carthage",False,0.0,13.0,,,,,1
jessesquires/JSQCoreDataKit,https://github.com/jessesquires/JSQCoreDataKit.git,616.0,2025.0,True,A swifter Core Data stack,Swift,"swift, ios, coredata, core-data",False,18.0,14.0,,6.0,14.0,,3
johnno1962/HotReloading,https://github.com/johnno1962/HotReloading.git,597.0,2025.0,True,Hot reloading as a Swift Package,Swift,"swift, swiftui, hot-reload",False,2.0,,,,,,0
johnpatrickmorgan/FlowStacks,https://github.com/johnpatrickmorgan/FlowStacks.git,925.0,2025.0,True,FlowStacks allows you to hoist SwiftUI navigation and presentation state into a Coordinator,Swift,,False,16.0,14.0,11.0,7.0,14.0,,4
johnpatrickmorgan/NavigationBackport,https://github.com/johnpatrickmorgan/NavigationBackport.git,913.0,2025.0,True,Backported SwiftUI navigation APIs introduced in WWDC22,Swift,,False,4.0,14.0,11.0,7.0,14.0,,4
JohnSundell/files,https://github.com/JohnSundell/files.git,2579.0,2025.0,True,A nicer way to handle files & folders in Swift,Swift,"files, folders, swift, script, swift-script, xcode",False,23.0,,,,,,0
jonreid/OCMockito,https://github.com/jonreid/OCMockito.git,993.0,2025.0,True,"Mockito for Objective-C: creation, verification and stubbing of mock objects",Objective-C,"objective-c, mockito, xctest, mocking-framework, testing, mocking",False,8.0,9.0,,2.0,12.0,,3
joshdholtz/DeckUI,https://github.com/joshdholtz/DeckUI.git,620.0,2025.0,True,Swift DSL for writing slide decks in Xcode,Swift,"slides, swift, swiftui, xcode",False,16.0,15.0,12.0,,,,2
jpsim/SourceKitten,https://github.com/jpsim/SourceKitten.git,2380.0,2025.0,True,An adorable little framework and command line tool for interacting with SourceKit.,Swift,,False,98.0,,12.0,,,,1
jpsim/Yams,https://github.com/jpsim/Yams.git,1183.0,2025.0,True,A Sweet and Swifty YAML parser.,Swift,"swift, libyaml, yaml, ios, macos, linux",False,28.0,,,,,,0
jtrivedi/Wave,https://github.com/jtrivedi/Wave.git,2222.0,2025.0,True,"Wave is a spring-based animation engine for iOS and macOS that makes it easy to create fluid, interruptible animations that feel great.",Swift,"animation, gestures, ios, motion, swift, interaction-design, uikit, ui, appkit, swiftui",False,11.0,13.0,,,,,1
kabiroberai/node-swift,https://github.com/kabiroberai/node-swift.git,551.0,2025.0,True,Create Node modules in Swift,Swift,,False,18.0,13.0,,,,,1
kaishin/Gifu,https://github.com/kaishin/Gifu.git,3176.0,2025.0,True,High-performance animated GIF support for iOS in Swift,Swift,"swift, carthage, gif, animation, cocoapods",False,29.0,12.0,,,12.0,1.0,3
kean/Nuke,https://github.com/kean/Nuke.git,8411.0,2025.0,True,Image loading system,Swift,"cache, image, swift, webp, gif, progressive",False,45.0,13.0,,6.0,13.0,1.0,4
kean/Pulse,https://github.com/kean/Pulse.git,6711.0,2025.0,True,Network logger for Apple platforms,Swift,"logger, networking, logging, ios, swift, macos",False,46.0,15.0,13.0,9.0,15.0,1.0,5
Kentzo/ShortcutRecorder,https://github.com/Kentzo/ShortcutRecorder.git,589.0,2025.0,True,"The best control to record shortcuts on macOS, written in ObjC with Swift in mind",Objective-C,"macos, cocoa, ui, shortcut",False,17.0,,,,,,0
KeyboardKit/KeyboardKit,https://github.com/KeyboardKit/KeyboardKit.git,1644.0,2025.0,True,"KeyboardKit lets you create custom keyboard extensions with a few lines of code, using Swift & SwiftUI.",Swift,"emoji, swift, swiftui, keyboard, keyboard-extension, ios, macos, tvos, watchos, apple, visionos",False,24.0,15.0,12.0,8.0,15.0,1.0,5
kif-framework/KIF,https://github.com/kif-framework/KIF.git,6236.0,2025.0,True,Keep It Functional - An iOS Functional Testing Framework,Objective-C,,False,51.0,13.0,,,,,1
kingslay/KSPlayer,https://github.com/kingslay/KSPlayer.git,1278.0,2025.0,True,"A video player for iOS、macOS、tvOS、visionOS , based on AVPlayer and FFmpeg, support the horizontal, vertical screen. support adjust volume, brightness and seek by slide, SwiftUI, support subtitles.",Swift,"swift, ios, macos, ffmpeg, avplayer, swiftui, tvos, video-player, visionos, audio-player",False,19.0,13.0,,,13.0,1.0,4
krzysztofzablocki/Difference,https://github.com/krzysztofzablocki/Difference.git,1231.0,2025.0,True,Simple way to identify what is different between 2 instances of any type. Must have for TDD.,Swift,"testing, ios, swift, macos, watchos, tvos",False,4.0,,,,,,0
krzysztofzablocki/Inject,https://github.com/krzysztofzablocki/Inject.git,2991.0,2025.0,True,Hot Reloading for Swift applications! ,Swift,"hot-reload, ios, swift, swiftui",False,4.0,11.0,,,13.0,,2
krzysztofzablocki/LifetimeTracker,https://github.com/krzysztofzablocki/LifetimeTracker.git,3249.0,2025.0,True,Find retain cycles / memory leaks sooner.,Swift,"memory-leaks, retain-cycles, tool, swift, ios",False,9.0,,,,,,0
krzysztofzablocki/sourcery,https://github.com/krzysztofzablocki/sourcery.git,7902.0,2025.0,True,"Meta-programming for Swift, stop writing boilerplate code.",Swift,"metaprogramming, swift, codegen, codegenerator, ios, templates, code-generation",False,86.0,,13.0,,,,1
krzyzanowskim/CryptoSwift,https://github.com/krzyzanowskim/CryptoSwift.git,10379.0,2025.0,True,CryptoSwift is a growing collection of standard and secure cryptographic algorithms implemented in Swift,Swift,"swift, aes, cryptography, commoncrypto, cryptoswift, md5, sha1, hmac-authentication, sha3, cipher, digest, aes-gcm, hmac",False,5.0,11.0,,4.0,11.0,,4
krzyzanowskim/STTextView,https://github.com/krzyzanowskim/STTextView.git,1311.0,2025.0,True,"Performant and reusable text view component (TextKit 2), with line numbers and more. UITextView / NSTextView replacement.",Swift,"textview, macos, textkit, swift, appkit, nstextview, cococa, editor, text, swiftui, textkit2, sttextview",False,1.0,16.0,12.0,,,,3
kstenerud/KSCrash,https://github.com/kstenerud/KSCrash.git,4358.0,2025.0,True,The Ultimate iOS Crash Reporter,Objective-C,,False,176.0,12.0,,5.0,12.0,,3
kvyatkovskys/KVKCalendar,https://github.com/kvyatkovskys/KVKCalendar.git,717.0,2025.0,True,A most fully customization calendar for Apple platforms 📅,Swift,"swift, ios, cocoapods, ios-calendar, ios-swift, calendar, kvkcalendar, carthage, calendar-view, timeline, swift-package-manager, customization-calendar, timeline-library, datepicker",False,25.0,13.0,,,,,1
lapfelix/bluetoothconnector,https://github.com/lapfelix/bluetoothconnector.git,545.0,2025.0,True,Simple macOS CLI to connect/disconnect a Bluetooth device. Useful for AirPods or other Bluetooth headphones.,Swift,"bluetooth, macos, airpods, beatsx, swift, swift-package, swift-package-manager, beats, macos-cli, automator-workflow, shortcut",False,5.0,,,,,,0
lascic/UIOnboarding,https://github.com/lascic/UIOnboarding.git,788.0,2025.0,True,Apple-esque animated welcome screen for iOS and iPadOS. Configurable.,Swift,"uikit, swift, swiftui, onboarding",False,5.0,13.0,,,,,1
layoutbox/flexlayout,https://github.com/layoutbox/flexlayout.git,2079.0,2025.0,True,"FlexLayout adds a nice Swift interface to the highly optimized facebook/yoga flexbox implementation. Concise, intuitive & chainable syntax.",Swift,"swift, ios, ios-swift, layout, layout-engine, flexbox, flex-layout, flexbox-container, css-flexbox, flex-container, flexbox-layout, yoga, flex-items, ios-lib, ios-ui, swift-3, swift-framework, flexbox-properties",False,1.0,13.0,,,,,1
layoutBox/PinLayout,https://github.com/layoutBox/PinLayout.git,2401.0,2025.0,True,"Fast Swift Views layouting without auto layout. No magic, pure code, full control and blazing fast. Concise syntax, intuitive, readable & chainable. [iOS/macOS/tvOS/CALayer]",Swift,"swift, layout-engine, carthage, cocoapod, chainable-methods, swift-3, swift-library, uiview-extension, ios, ios-swift, ios-lib, layout, rtl, left-language, margin, anchor, ios-ui, swift-framework, language",False,16.0,,,,,,0
li6185377/LKDBHelper-SQLite-ORM,https://github.com/li6185377/LKDBHelper-SQLite-ORM.git,1207.0,2025.0,True,"全自动的插入,查询,更新,删除， an automatic database operation  thread-safe and not afraid of recursive deadlock",Objective-C,,False,2.0,,,,,,0
line/line-sdk-ios-swift,https://github.com/line/line-sdk-ios-swift.git,870.0,2025.0,True,Provides a modern way of implementing LINE APIs.,Swift,"line, line-sdk, line-login, swift",False,7.0,13.0,,,,,1
lucaszischka/BottomSheet,https://github.com/lucaszischka/BottomSheet.git,1182.0,2025.0,True,A sliding Sheet from the bottom of the Screen with 3 States build with SwiftUI.,Swift,"bottomsheet, swiftui, swift, swift5, xcode, hacktoberfest",False,23.0,13.0,,,,,2
lyft/hammer,https://github.com/lyft/hammer.git,700.0,2025.0,True,iOS touch synthesis library,Swift,"ui-testing, testing, ios, lyft",False,7.0,12.0,,,,,1
mac-cain13/R.swift,https://github.com/mac-cain13/R.swift.git,9583.0,2025.0,True,"Strong typed, autocompleted resources like images, fonts and segues in Swift projects",Swift,"swift, ios, watchos, tvos, code-generator, autocompletion, xcode, resources",False,74.0,11.0,,4.0,11.0,,3
MacPaw/OpenAI,https://github.com/MacPaw/OpenAI.git,2632.0,2025.0,True,Swift community driven package for OpenAI public API,Swift,"ai, openai, openai-api, spm, swift, swiftpackagemanager",False,23.0,13.0,,6.0,13.0,1.0,4
mapbox/Fingertips,https://github.com/mapbox/Fingertips.git,826.0,2025.0,True,Touch indicators on external displays for iOS applications.,Swift,,False,3.0,11.0,,,,,1
mapbox/mapbox-maps-ios,https://github.com/mapbox/mapbox-maps-ios.git,540.0,2025.0,True,"Interactive, thoroughly customizable maps for iOS powered by vector tiles and Metal",Swift,"mapbox, maps, map, metal, swift, ios, priority",False,249.0,14.0,,,,,1
mapbox/mapbox-navigation-ios,https://github.com/mapbox/mapbox-navigation-ios.git,891.0,2025.0,True,Turn-by-turn navigation logic and UI in Swift on iOS,Swift,"in-scope, priority",False,198.0,14.0,,,,,1
marcoarment/Blackbird,https://github.com/marcoarment/Blackbird.git,966.0,2025.0,True,,Swift,,False,11.0,15.0,12.0,8.0,15.0,,4
marmelroy/PhoneNumberKit,https://github.com/marmelroy/PhoneNumberKit.git,5273.0,2025.0,True,"A Swift framework for parsing, formatting and validating international phone numbers. Inspired by Google's libphonenumber.",Swift,"phone-number, google-libphonenumber, swift, parsing, validation, contacts, formatting",False,14.0,12.0,,4.0,12.0,,3
mattmassicotte/ConcurrencyRecipes,https://github.com/mattmassicotte/ConcurrencyRecipes.git,1268.0,2025.0,True,Practical solutions to problems with Swift Concurrency,Swift,,False,2.0,,,,,,0
mchakravarty/CodeEditorView,https://github.com/mchakravarty/CodeEditorView.git,801.0,2025.0,True,"SwiftUI code editor view for iOS, visionOS, and macOS",Swift,"swiftui, ios, macos, editor, visionos",False,55.0,17.0,14.0,,,1.0,3
mergesort/Boutique,https://github.com/mergesort/Boutique.git,1084.0,2025.0,True,✨ A magical persistence library (and so much more) for state-driven iOS and Mac apps ✨,Swift,"actors, cache, database, ios, macos, offline-first, persistence, swift, appkit, swiftui, uikit",False,5.0,17.0,14.0,,,,2
MessageKit/MessageKit,https://github.com/MessageKit/MessageKit.git,6181.0,2025.0,True,A community-driven replacement for JSQMessagesViewController,Swift,"messaging, messenger, message, jsqmessagesviewcontroller, swift, viewcontroller, hacktoberfest, ios, chat",False,76.0,14.0,,,,,1
michaeleisel/ZippyJSON,https://github.com/michaeleisel/ZippyJSON.git,941.0,2025.0,True,A much faster version of JSONDecoder,Swift,,False,2.0,11.0,,,11.0,,2
microsoft/appcenter-sdk-apple,https://github.com/microsoft/appcenter-sdk-apple.git,573.0,2025.0,True,"Development repository for the App Center SDK for iOS, macOS and tvOS.",Objective-C,appcenter,False,0.0,12.0,,,12.0,,2
microsoft/fluentui-apple,https://github.com/microsoft/fluentui-apple.git,946.0,2025.0,True,UIKit and AppKit controls for building native Microsoft experiences,Swift,"microsoft, uikit, appkit, cocoa, macos, ios, fluentui-apple",False,35.0,16.0,13.0,,,1.0,3
microsoft/plcrashreporter,https://github.com/microsoft/plcrashreporter.git,3000.0,2025.0,True,"Reliable, open-source crash reporting for iOS, macOS and tvOS",Objective-C,"crash-reporting, ios, macos",False,0.0,11.0,,,11.0,,2
migueldeicaza/SwiftGodot,https://github.com/migueldeicaza/SwiftGodot.git,1417.0,2025.0,True,New Godot bindings for Swift,Swift,,False,107.0,,14.0,,,,1
migueldeicaza/SwiftTerm,https://github.com/migueldeicaza/SwiftTerm.git,1125.0,2025.0,True,Xterm/VT100 Terminal emulator in Swift,Swift,"macos, ios, swift, xterm-256color, xterm, uikit, appkit, vt100, sixel, imgcat, terminal-engine, ssh-connection",False,65.0,13.0,,,13.0,1.0,3
mihaelisaev/UIKitPlus,https://github.com/mihaelisaev/UIKitPlus.git,610.0,2025.0,True,🏰 Declarative UIKit with LivePreview for iOS9+ (best alternative to SwiftUI),Swift,"swift, uikit, wrapper, betterthanswiftui",False,19.0,9.0,,,13.0,,2
Mijick/Popups,https://github.com/Mijick/Popups.git,1630.0,2025.0,True,"Popups, popovers, sheets, alerts, toasts, banners, (...) presentation made simple. Written with and for SwiftUI.",Swift,"popup, swift, swift-package-manager, swiftui, swiftui-components, swiftui-framework, alert, toast, ios, ios-swift, swift-library, swift-package, cocoapods, ios-sdk, mobile, swift6, popupview, popupwindow, popup-window, popover",False,22.0,14.0,12.0,7.0,15.0,1.0,5
mischa-hildebrand/AlignedCollectionViewFlowLayout,https://github.com/mischa-hildebrand/AlignedCollectionViewFlowLayout.git,1368.0,2025.0,True,A collection view layout that gives you control over the horizontal and vertical alignment of the cells.,Swift,"ios, uicollectionview, uicollectionviewflowlayout, uicollectionviewlayout, alignment, swift, uikit",False,16.0,,,,,,0
ml-explore/mlx-swift-examples,https://github.com/ml-explore/mlx-swift-examples.git,1983.0,2025.0,True,Examples using MLX Swift,Swift,mlx,False,48.0,16.0,14.0,,,,2
MobileNativeFoundation/Kronos,https://github.com/MobileNativeFoundation/Kronos.git,680.0,2025.0,True,Elegant NTP date library in Swift,Swift,lyft,False,19.0,,,,,,0
MobileNativeFoundation/XCLogParser,https://github.com/MobileNativeFoundation/XCLogParser.git,1786.0,2025.0,True,Tool to parse Xcode and xcodebuild logs stored in the xcactivitylog format,Swift,"swift, swift-package-manager, xcode, xcactivitylog",False,40.0,,,,,,0
modelcontextprotocol/swift-sdk,https://github.com/modelcontextprotocol/swift-sdk.git,862.0,2025.0,True,The official Swift SDK for Model Context Protocol servers and clients.,Swift,"mcp, swift",False,42.0,,,,,,0
mono0926/LicensePlist,https://github.com/mono0926/LicensePlist.git,2481.0,2025.0,True,A license list generator of all your dependencies for iOS applications,Swift,"license, license-management, licenses, ios, settings, swift-package-manager, cli, commandline, xcode, automation, productivity",False,38.0,,,,,,0
mozilla-mobile/firefox-ios,https://github.com/mozilla-mobile/firefox-ios.git,12623.0,2025.0,True,Firefox for iOS,Swift,"swift, browser, ios-app, firefox, mozilla",False,1804.0,,,,,,0
mxcl/PromiseKit,https://github.com/mxcl/PromiseKit.git,14264.0,2025.0,True,Promises for Swift & ObjC.,Swift,"swift, objc, promises",False,15.0,,,,,,0
mxcl/swift-sh,https://github.com/mxcl/swift-sh.git,1853.0,2025.0,True,Easily script with third-party Swift dependencies.,Swift,"swift, scripting",False,21.0,,,,,,0
nalexn/ViewInspector,https://github.com/nalexn/ViewInspector.git,2449.0,2025.0,True,Runtime introspection and unit testing of SwiftUI views,Swift,"swiftui, swiftui-views, unit-testing, runtime-typechecking, best-practices, swift, swift5",False,45.0,12.0,,7.0,13.0,1.0,4
nathantannar4/Transmission,https://github.com/nathantannar4/Transmission.git,872.0,2025.0,True,"Bridges UIKit presentation APIs to a SwiftUI API so you can use presentation controllers, interactive transitions and more.",Swift,,False,5.0,13.0,,,,1.0,3
nerdishbynature/octokit.swift,https://github.com/nerdishbynature/octokit.swift.git,513.0,2025.0,True,A Swift API Client for GitHub and GitHub Enterprise,Swift,"swift, oauth-flow, github-enterprise, octokit, api-client, github, github-api",False,6.0,,,,,,0
nicklockwood/Euclid,https://github.com/nicklockwood/Euclid.git,667.0,2025.0,True,A Swift library for creating and manipulating 3D geometry,Swift,,False,16.0,,,,,,0
nicklockwood/SwiftFormat,https://github.com/nicklockwood/SwiftFormat.git,8472.0,2025.0,True,A command-line tool and Xcode Extension for formatting Swift code,Swift,,False,311.0,,,,,,0
Nike-Inc/Willow,https://github.com/Nike-Inc/Willow.git,1367.0,2025.0,True,"Willow is a powerful, yet lightweight logging library written in Swift.",Swift,,False,10.0,10.0,,3.0,10.0,,3
nmdias/FeedKit,https://github.com/nmdias/FeedKit.git,1274.0,2025.0,True,"FeedKit is a Swift library for Reading and Generating RSS, Atom, and JSON feeds.",Swift,"rss, atom, swift, rss-reader, atom-feed-parser, atom-reader, rss-feed-parser, feed-parser, feedkit, parsing",False,3.0,15.0,12.0,8.0,15.0,1.0,5
NordicSemiconductor/IOS-DFU-Library,https://github.com/NordicSemiconductor/IOS-DFU-Library.git,560.0,2025.0,True,"OTA DFU Library for Mac and iOS, compatible with nRF5x SoCs",Swift,"dfu, ota, nrf51, nrf52, ble, bluetooth-low-energy, bluetooth, bluetooth-le, bluetoothsmart",False,20.0,12.0,,4.0,12.0,,3
nytimes/NYTPhotoViewer,https://github.com/nytimes/NYTPhotoViewer.git,2876.0,2025.0,True,A modern photo viewing experience for iOS.,Objective-C,,False,80.0,9.0,,,,,1
objectbox/objectbox-swift,https://github.com/objectbox/objectbox-swift.git,540.0,2025.0,True,"Swift database - fast, simple and lightweight (iOS, macOS)",Swift,"ios, database, edge, embedded, mobile, nosql, swift, local, offline-first, storage, sustainable, sync",False,17.0,12.0,,,,,1
onevcat/fengniao,https://github.com/onevcat/fengniao.git,3491.0,2025.0,True,A command line tool for cleaning unused resources in Xcode.,Swift,"command-line-tool, resources, slim, xcode, images, cleanup, swift",False,28.0,,,,,,0
onevcat/Kingfisher,https://github.com/onevcat/Kingfisher.git,23972.0,2025.0,True,"A lightweight, pure-Swift library for downloading and caching images from the web.",Swift,"swift, kingfisher, image, cache, filters, image-processor, xcode, ios, macos",False,162.0,13.0,,6.0,13.0,,3
onevcat/Rainbow,https://github.com/onevcat/Rainbow.git,1894.0,2025.0,True,Delightful console output for Swift developers.,Swift,"swift, console, log, output",False,1.0,,,,,,0
open-meteo/open-meteo,https://github.com/open-meteo/open-meteo.git,3467.0,2025.0,True,Free Weather Forecast API for non-commercial use,Swift,"weather-api, weather, weather-forecast",False,128.0,,15.0,,,,1
openid/AppAuth-iOS,https://github.com/openid/AppAuth-iOS.git,1902.0,2025.0,True,iOS and macOS SDK for communicating with OAuth 2.0 and OpenID Connect providers.,Objective-C,"oauth2, openid-connect, ios-sdk",False,227.0,12.0,,2.0,9.0,,3
OpenSwiftUIProject/OpenSwiftUI,https://github.com/OpenSwiftUIProject/OpenSwiftUI.git,1568.0,2025.0,True,[WIP] Open source implementation of Apple's SwiftUI.,Swift,,False,15.0,,,,,,0
orlandos-nl/MongoKitten,https://github.com/orlandos-nl/MongoKitten.git,745.0,2025.0,True,"Native MongoDB driver for Swift, written in Swift",Swift,"swift, mongodb, mongokitten, mongodb-driver, swift-package-manager, vapor, server-side-swift, database",False,24.0,13.0,13.0,,,,2
peripheryapp/periphery,https://github.com/peripheryapp/periphery.git,5789.0,2025.0,True,A tool to identify unused code in Swift projects.,Swift,"swift, xcode, ios, macos, apple",False,60.0,,13.0,,,,1
phimage/Prephirences,https://github.com/phimage/Prephirences.git,574.0,2025.0,True,"Prephirences is a Swift library that provides useful protocols and convenience methods to manage application preferences, configurations and app-state. UserDefaults",Swift,"userdefaults, swift, preferences, plist, keychain, configuration, ios-swift, ios, property-wrapper",False,4.0,9.0,,3.0,9.0,,3
piemonte/Twinkle,https://github.com/piemonte/Twinkle.git,614.0,2025.0,True,:sparkles: Twinkle interface elements in Swift,Swift,"twinkle, swift, animation, tvos, sparkle, ios, sparkles, caemitterlayer, particles",False,5.0,15.0,,,15.0,,2
